<?xml version="1.0" encoding="UTF-8"?>
<!--
To change this license header, choose License Headers in Project Properties.
To change this template file, choose Tools | Templates
and open the template in the editor.
-->


<DSHoKhau
    xmlns:xsi='http://www.w3.org/2001/XMLSchema-instance'
    xsi:noNamespaceSchemaLocation='BTTH2_Lab3.xsd'>
    <HoKhau>
        <DiaChi>
            <sonha>23</sonha>
            <duong>Phạm Văn Đồng</duong>
            <phuong>Mai Dịch</phuong>
            <quan>Cầu Giấy</quan>
            <thanhpho>Hà Nội</thanhpho>
        </DiaChi>
        <ChuHo>
            <soCMND>123456789</soCMND>
            <ho>Vu</ho>
            <ten>Minh</ten>
            <nguyenquan>Hoàng Mai</nguyenquan>
            <gioiTinh>Nam</gioiTinh>
            <ngaySinh>1970-11-11</ngaySinh>
        </ChuHo>
        <ThanhVien>
            <soCMND>123456789</soCMND>
            <ho>Vu</ho>
            <ten>Tung Lam</ten>
            <nguyenquan>Hoàng Mai</nguyenquan>
            <gioiTinh>Nam</gioiTinh>
            <ngaySinh>2005-11-11</ngaySinh>
            <moiQuanHe>Con</moiQuanHe>
        </ThanhVien>
        <ThanhVien>
            <soCMND>123456789</soCMND>
            <ho>Lai</ho>
            <ten>Anh</ten>
            <nguyenquan>Hoàng Mai</nguyenquan>
            <gioiTinh>Nữ</gioiTinh>
            <ngaySinh>2005-11-11</ngaySinh>
            <moiQuanHe>Vợ</moiQuanHe>
        </ThanhVien>
    </HoKhau>
</DSHoKhau>
